{
  "schema": "rclcppyy.compatibility/v2",
  "ros_distribution": "jazzy",
  "reviewed_at": "2026-07-26",
  "upstream_contract": {
    "manifest": "compatibility/upstream-rclpy-contract.json",
    "coverage": [
      {
        "path": "test_action_graph.py",
        "disposition": "selected",
        "entry_id": "action.graph_queries"
      },
      {
        "path": "test_action_client.py",
        "disposition": "selected",
        "entry_id": "action.client_server"
      },
      {
        "path": "test_action_server.py",
        "disposition": "selected",
        "entry_id": "action.concurrent_abort_error_expiry"
      },
      {
        "path": "test_callback_group.py",
        "disposition": "selected",
        "entry_id": "executor.stock_extensions"
      },
      {
        "path": "test_client.py",
        "disposition": "selected",
        "entry_id": "service.extended_stock_surface"
      },
      {
        "path": "test_create_node.py",
        "disposition": "selected",
        "entry_id": "node.create_node"
      },
      {
        "path": "test_create_while_spinning.py",
        "disposition": "selected",
        "entry_id": "node.extended_stock_surface"
      },
      {
        "path": "test_destruction.py",
        "disposition": "selected",
        "entry_id": "node.extended_stock_surface"
      },
      {
        "path": "test_events_executor.py",
        "disposition": "selected",
        "entry_id": "executor.stock_extensions"
      },
      {
        "path": "test_executor.py",
        "disposition": "selected",
        "entry_id": "executor.stock_extensions"
      },
      {
        "path": "test_guard_condition.py",
        "disposition": "selected",
        "entry_id": "executor.guard_condition"
      },
      {
        "path": "test_init_shutdown.py",
        "disposition": "selected",
        "entry_id": "context.stock_initialization"
      },
      {
        "path": "test_lifecycle.py",
        "disposition": "selected",
        "entry_id": "lifecycle.node"
      },
      {
        "path": "test_logging.py",
        "disposition": "selected",
        "entry_id": "logging.stock_surface"
      },
      {
        "path": "test_logging_rosout.py",
        "disposition": "selected",
        "entry_id": "logging.stock_surface"
      },
      {
        "path": "test_logging_service.py",
        "disposition": "selected",
        "entry_id": "logging.stock_surface"
      },
      {
        "path": "test_node.py",
        "disposition": "selected",
        "entry_id": "node.extended_stock_surface"
      },
      {
        "path": "test_parameter.py",
        "disposition": "selected",
        "entry_id": "parameter.value_and_event_helpers"
      },
      {
        "path": "test_parameter_client.py",
        "disposition": "selected",
        "entry_id": "parameter.remote"
      },
      {
        "path": "test_parameter_event_handler.py",
        "disposition": "selected",
        "entry_id": "parameter.value_and_event_helpers"
      },
      {
        "path": "test_parameter_service.py",
        "disposition": "selected",
        "entry_id": "parameter.local"
      },
      {
        "path": "test_publisher.py",
        "disposition": "selected",
        "entry_id": "publisher.basic"
      },
      {
        "path": "test_qos.py",
        "disposition": "selected",
        "entry_id": "qos.stock_surface"
      },
      {
        "path": "test_qos_event.py",
        "disposition": "selected",
        "entry_id": "qos.stock_surface"
      },
      {
        "path": "test_qos_overriding_options.py",
        "disposition": "selected",
        "entry_id": "qos.stock_surface"
      },
      {
        "path": "test_rate.py",
        "disposition": "selected",
        "entry_id": "time.stock_surface"
      },
      {
        "path": "test_rosout_subscription.py",
        "disposition": "selected",
        "entry_id": "logging.stock_surface"
      },
      {
        "path": "test_serialization.py",
        "disposition": "selected",
        "entry_id": "serialization.stock_functions"
      },
      {
        "path": "test_service.py",
        "disposition": "selected",
        "entry_id": "service.client_server"
      },
      {
        "path": "test_service_introspection.py",
        "disposition": "selected",
        "entry_id": "service.extended_stock_surface"
      },
      {
        "path": "test_subscription.py",
        "disposition": "selected",
        "entry_id": "subscription.advanced_options"
      },
      {
        "path": "test_timer.py",
        "disposition": "selected",
        "entry_id": "timer.wall"
      },
      {
        "path": "test_time_source.py",
        "disposition": "selected",
        "entry_id": "time.stock_surface"
      },
      {
        "path": "test_wait_for_message.py",
        "disposition": "selected",
        "entry_id": "subscription.wait_for_message"
      },
      {
        "path": "test_waitable.py",
        "disposition": "selected",
        "entry_id": "executor.stock_extensions"
      },
      {
        "path": "test_clock.py",
        "disposition": "selected",
        "entry_id": "time.stock_surface"
      },
      {
        "path": "test_context.py",
        "disposition": "selected",
        "entry_id": "context.stock_initialization"
      },
      {
        "path": "test_expand_topic_name.py",
        "disposition": "selected",
        "entry_id": "graph.utility_surface"
      },
      {
        "path": "test_messages.py",
        "disposition": "selected",
        "entry_id": "message.value_semantics"
      },
      {
        "path": "test_task.py",
        "disposition": "selected",
        "entry_id": "executor.stock_extensions"
      },
      {
        "path": "test_time.py",
        "disposition": "selected",
        "entry_id": "time.stock_surface"
      },
      {
        "path": "test_topic_endpoint_info.py",
        "disposition": "selected",
        "entry_id": "graph.utility_surface"
      },
      {
        "path": "test_topic_or_service_is_hidden.py",
        "disposition": "selected",
        "entry_id": "graph.utility_surface"
      },
      {
        "path": "test_type_hash.py",
        "disposition": "selected",
        "entry_id": "type_support.stock_surface"
      },
      {
        "path": "test_utilities.py",
        "disposition": "selected",
        "entry_id": "utility.process_surface"
      },
      {
        "path": "test_validate_full_topic_name.py",
        "disposition": "selected",
        "entry_id": "graph.utility_surface"
      },
      {
        "path": "test_validate_namespace.py",
        "disposition": "selected",
        "entry_id": "graph.utility_surface"
      },
      {
        "path": "test_validate_node_name.py",
        "disposition": "selected",
        "entry_id": "graph.utility_surface"
      },
      {
        "path": "test_validate_topic_name.py",
        "disposition": "selected",
        "entry_id": "graph.utility_surface"
      },
      {
        "path": "test_destruction_order.py",
        "disposition": "reviewed_exclusion",
        "entry_id": "node.private_destruction_order"
      },
      {
        "path": "test_type_description_service.py",
        "disposition": "reviewed_exclusion",
        "entry_id": "type_support.type_description_service"
      },
      {
        "path": "test_type_support.py",
        "disposition": "reviewed_exclusion",
        "entry_id": "type_support.negative_validation"
      }
    ]
  },
  "entries": [
    {
      "id": "activation.source.enable",
      "area": "activation",
      "api": "rclcppyy.enable_cpp_acceleration() before rclpy/message imports",
      "support": "certified",
      "backend": "python",
      "fallback": "safe",
      "default": true,
      "evidence": [
        "test/test_monkeypatch.py",
        "test/_monkeypatch_helper.py",
        "test/test_lazy_imports.py",
        "test/_lazy_import_helper.py"
      ],
      "notes": "The default compatible profile preserves stock node, context, executor, message, entity, and Publisher.publish authority. Its import and activation graph excludes cppyy, Cling bringup, native factories, and the legacy node. Explicit publisher_cpp and required_cpp profiles separately expose the certified same-handle C++ publisher route."
    },
    {
      "id": "activation.startup_hook.enabled",
      "area": "activation",
      "api": "RCLCPPYY_ENABLE_HOOK=1 with an installed startup hook",
      "support": "certified",
      "backend": "python",
      "fallback": "safe",
      "default": false,
      "evidence": [
        "test/test_hook.py",
        "rclcppyy/_hook_boot.py"
      ],
      "notes": "A fresh interpreter proves default compatible startup activation. Node, Publisher.publish, executor, and Future behavior remains stock-authoritative and reports Python authority."
    },
    {
      "id": "activation.startup_hook.direct_cpp",
      "area": "activation",
      "api": "RCLCPPYY_ENABLE_HOOK=1 with RCLCPPYY_HOOK_PROFILE=direct_cpp and optional registered interfaces/optimizations",
      "support": "experimental",
      "backend": "cpp",
      "fallback": "safe",
      "default": false,
      "evidence": [
        "test/test_hook.py",
        "rclcppyy/_hook_boot.py",
        "rclcppyy/direct_cpp.py"
      ],
      "notes": "The explicitly selected direct profile activates from the installed startup bootstrap before rclpy eagerly imports generated control messages. A fresh Jazzy/Cyclone process proves an unchanged user import receives the direct Node and exact generated C++ nested Header/Time classes registered through the comma-separated interface input. Entity operations retain the bounded direct_cpp fail-closed contract and never fall back through an application-message conversion or serialized route. Compatible remains the default hook profile."
    },
    {
      "id": "activation.startup_hook.disabled",
      "area": "activation",